{
	"name": "Movies or Countries",
	"description": "Workflow description",
	"version": "1.0.0",
	"trigger": {
		"http": {
			"method": "GET",
			"path": "/",
			"accept": "application/json"
		}
	},
	"steps": [
		{
			"name": "filter-request",
			"node": "@blok/if-else",
			"type": "module"
		}
	],
	"nodes": {
		"filter-request": {
			"conditions": [
				{
					"type": "if",
					"steps": [
						{
							"name": "get-countries",
							"node": "@blok/api-call",
							"type": "module"
						}
					],
					"condition": "ctx.request.query.countries === \"true\""
				},
				{
					"type": "else",
					"steps": [
						{
							"name": "get-facts",
							"node": "@blok/api-call",
							"type": "module"
						}
					]
				}
			]
		},
		"get-facts": {
			"inputs": {
				"url": "https://catfact.ninja/fact",
				"method": "GET",
				"headers": {
					"Content-Type": "application/json"
				},
				"responseType": "application/json"
			}
		},
		"get-countries": {
			"inputs": {
				"url": "https://countriesnow.space/api/v0.1/countries/capital",
				"method": "GET",
				"headers": {
					"Content-Type": "application/json"
				},
				"responseType": "application/json"
			}
		}
	}
}
