{
	"name": "World Countries",
	"description": "Workflow description",
	"version": "1.0.0",
	"trigger": {
		"http": {
			"method": "GET",
			"path": "/",
			"accept": "application/json"
		}
	},
	"steps": [
		{
			"name": "get-countries-api",
			"node": "@blokjs/api-call",
			"type": "module"
		}
	],
	"nodes": {
		"get-countries-api": {
			"inputs": {
				"url": "https://countriesnow.space/api/v0.1/countries/capital",
				"method": "GET",
				"headers": {
					"Content-Type": "application/json"
				},
				"responseType": "application/json"
			}
		}
	}
}
